[
  {
    "id": "f_784010",
    "schema_version": 1,
    "kind": "spark.conf_effective",
    "subject": {
      "type": "job_run",
      "symbol": "spark.app.name"
    },
    "measures": {},
    "attrs": {
      "key": "spark.app.name",
      "value": "duration_skew_at_threshold_job",
      "app_id": "application_1699000000000_0011",
      "source_event": "SparkListenerEnvironmentUpdate"
    },
    "provenance": {
      "artifact": "eventlog.jsonl",
      "artifact_sha256": "",
      "extractor": "event_log@0.1.0"
    }
  },
  {
    "id": "f_93d162",
    "schema_version": 1,
    "kind": "spark.conf_effective",
    "subject": {
      "type": "job_run",
      "symbol": "spark.executor.cores"
    },
    "measures": {},
    "attrs": {
      "key": "spark.executor.cores",
      "value": "4",
      "app_id": "application_1699000000000_0011",
      "source_event": "SparkListenerEnvironmentUpdate"
    },
    "provenance": {
      "artifact": "eventlog.jsonl",
      "artifact_sha256": "",
      "extractor": "event_log@0.1.0"
    }
  },
  {
    "id": "f_f3132e",
    "schema_version": 1,
    "kind": "spark.conf_effective",
    "subject": {
      "type": "job_run",
      "symbol": "spark.executor.instances"
    },
    "measures": {},
    "attrs": {
      "key": "spark.executor.instances",
      "value": "2",
      "app_id": "application_1699000000000_0011",
      "source_event": "SparkListenerEnvironmentUpdate"
    },
    "provenance": {
      "artifact": "eventlog.jsonl",
      "artifact_sha256": "",
      "extractor": "event_log@0.1.0"
    }
  },
  {
    "id": "f_00b1ed",
    "schema_version": 1,
    "kind": "spark.conf_effective",
    "subject": {
      "type": "job_run",
      "symbol": "spark.master"
    },
    "measures": {},
    "attrs": {
      "key": "spark.master",
      "value": "yarn",
      "app_id": "application_1699000000000_0011",
      "source_event": "SparkListenerEnvironmentUpdate"
    },
    "provenance": {
      "artifact": "eventlog.jsonl",
      "artifact_sha256": "",
      "extractor": "event_log@0.1.0"
    }
  },
  {
    "id": "f_315411",
    "schema_version": 1,
    "kind": "spark.conf_effective",
    "subject": {
      "type": "job_run",
      "symbol": "spark.version"
    },
    "measures": {},
    "attrs": {
      "key": "spark.version",
      "value": "3.5.4",
      "app_id": "application_1699000000000_0011",
      "source_event": "SparkListenerEnvironmentUpdate"
    },
    "provenance": {
      "artifact": "eventlog.jsonl",
      "artifact_sha256": "",
      "extractor": "event_log@0.1.0"
    }
  },
  {
    "id": "f_ae8469",
    "schema_version": 1,
    "kind": "spark.runtime_version",
    "subject": {
      "type": "job_run",
      "symbol": "application_1699000000000_0011"
    },
    "measures": {},
    "attrs": {
      "component": "spark",
      "version": "3.5.4",
      "source_event": "SparkListenerLogStart"
    },
    "provenance": {
      "artifact": "eventlog.jsonl",
      "artifact_sha256": "",
      "extractor": "event_log@0.1.0"
    }
  },
  {
    "id": "f_f55fbf",
    "schema_version": 1,
    "kind": "spark.stage.slow_tasks",
    "subject": {
      "type": "stage",
      "symbol": "stage_shuffle_skew_at_threshold",
      "stage_id": 0
    },
    "measures": {
      "task_count": 8,
      "slow_count": 1,
      "threshold_ms": 1500.0,
      "median_ms": 1000.0,
      "median_read_bytes": 18000000.0
    },
    "attrs": {
      "multiplier": 1.5,
      "quantile": 0.75,
      "min_task_ms": 100.0,
      "criterion_source": "spark_default",
      "by_executor": {
        "2": {
          "slow": 1,
          "host": "10.0.0.12",
          "max_slow_read_bytes": 34000000,
          "read_known": true
        }
      }
    },
    "provenance": {
      "artifact": "eventlog.jsonl",
      "artifact_sha256": "",
      "extractor": "event_log@0.1.0"
    }
  },
  {
    "id": "f_9a473d",
    "schema_version": 1,
    "kind": "spark.stage.slow_tasks",
    "subject": {
      "type": "stage",
      "symbol": "stage_shuffle_below_threshold",
      "stage_id": 1
    },
    "measures": {
      "task_count": 8,
      "slow_count": 1,
      "threshold_ms": 1500.0,
      "median_ms": 1000.0,
      "median_read_bytes": 18000000.0
    },
    "attrs": {
      "multiplier": 1.5,
      "quantile": 0.75,
      "min_task_ms": 100.0,
      "criterion_source": "spark_default",
      "by_executor": {
        "2": {
          "slow": 1,
          "host": "10.0.0.12",
          "max_slow_read_bytes": 33000000,
          "read_known": true
        }
      }
    },
    "provenance": {
      "artifact": "eventlog.jsonl",
      "artifact_sha256": "",
      "extractor": "event_log@0.1.0"
    }
  },
  {
    "id": "f_a6cfac",
    "schema_version": 1,
    "kind": "spark.stage.task_duration",
    "subject": {
      "type": "stage",
      "symbol": "stage_shuffle_skew_at_threshold",
      "stage_id": 0
    },
    "measures": {
      "min_ms": 1000,
      "p50_ms": 1000,
      "p95_ms": 3000,
      "max_ms": 3000,
      "mean_ms": 1250.0,
      "task_count": 8
    },
    "attrs": {},
    "provenance": {
      "artifact": "eventlog.jsonl",
      "artifact_sha256": "",
      "extractor": "event_log@0.1.0"
    }
  },
  {
    "id": "f_3ae49c",
    "schema_version": 1,
    "kind": "spark.stage.task_duration",
    "subject": {
      "type": "stage",
      "symbol": "stage_shuffle_below_threshold",
      "stage_id": 1
    },
    "measures": {
      "min_ms": 1000,
      "p50_ms": 1000,
      "p95_ms": 2900,
      "max_ms": 2900,
      "mean_ms": 1237.5,
      "task_count": 8
    },
    "attrs": {},
    "provenance": {
      "artifact": "eventlog.jsonl",
      "artifact_sha256": "",
      "extractor": "event_log@0.1.0"
    }
  }
]
