[
  {
    "id": "f_79bef5",
    "schema_version": 1,
    "kind": "kafka.analyzed",
    "subject": {
      "type": "source_location",
      "file": "E:\\projetos\\spark-forge-aws\\fixtures\\transport\\kafka_isr_deficit\\input\\dump.json",
      "line": 1,
      "col": 0,
      "symbol": "",
      "snippet": ""
    },
    "measures": {
      "record_count": 1,
      "unresolved_count": 0
    },
    "attrs": {
      "artifact_type": "kafka"
    },
    "provenance": {
      "artifact": "E:\\projetos\\spark-forge-aws\\fixtures\\transport\\kafka_isr_deficit\\input\\dump.json",
      "artifact_sha256": "0d41954c048041d93d844c7d3e03e963b6c9e558b1eefe7082e6cf3d7a854422",
      "extractor": "streaming_transport@0.1.0"
    }
  },
  {
    "id": "f_10c64a",
    "schema_version": 1,
    "kind": "kafka.partition",
    "subject": {
      "type": "source_location",
      "file": "E:\\projetos\\spark-forge-aws\\fixtures\\transport\\kafka_isr_deficit\\input\\dump.json",
      "line": 1,
      "col": 0,
      "symbol": "",
      "snippet": ""
    },
    "measures": {
      "partition": 0,
      "leader": 1,
      "replication_factor": 3,
      "isr_count": 2
    },
    "attrs": {
      "topic": "events",
      "replicas": [
        1,
        2,
        3
      ],
      "isr": [
        1,
        2
      ]
    },
    "provenance": {
      "artifact": "E:\\projetos\\spark-forge-aws\\fixtures\\transport\\kafka_isr_deficit\\input\\dump.json",
      "artifact_sha256": "0d41954c048041d93d844c7d3e03e963b6c9e558b1eefe7082e6cf3d7a854422",
      "extractor": "streaming_transport@0.1.0"
    }
  },
  {
    "id": "f_ddb77a",
    "schema_version": 1,
    "kind": "kafka.topic",
    "subject": {
      "type": "source_location",
      "file": "E:\\projetos\\spark-forge-aws\\fixtures\\transport\\kafka_isr_deficit\\input\\dump.json",
      "line": 1,
      "col": 0,
      "symbol": "",
      "snippet": ""
    },
    "measures": {
      "partition_count": 1
    },
    "attrs": {
      "name": "events"
    },
    "provenance": {
      "artifact": "E:\\projetos\\spark-forge-aws\\fixtures\\transport\\kafka_isr_deficit\\input\\dump.json",
      "artifact_sha256": "0d41954c048041d93d844c7d3e03e963b6c9e558b1eefe7082e6cf3d7a854422",
      "extractor": "streaming_transport@0.1.0"
    }
  }
]