[
  {
    "id": "f_6ed4a0",
    "schema_version": 1,
    "kind": "streaming.progress.analyzed",
    "subject": {
      "type": "source_location",
      "file": "E:\\projetos\\spark-forge-aws\\fixtures\\streaming\\progress_unresolved\\input\\progress.jsonl",
      "line": 0,
      "col": 0,
      "symbol": "",
      "snippet": ""
    },
    "measures": {
      "record_count": 1,
      "unresolved_count": 2,
      "series_count": 0
    },
    "attrs": {
      "parsed": true
    },
    "provenance": {
      "artifact": "E:\\projetos\\spark-forge-aws\\fixtures\\streaming\\progress_unresolved\\input\\progress.jsonl",
      "artifact_sha256": "4b1732a2633c4df7411a29ea11ce0f86437bcee5de1191b837e5a1b5a5fdcf2a",
      "extractor": "streaming_progress@0.1.0"
    }
  },
  {
    "id": "f_53a00f",
    "schema_version": 1,
    "kind": "streaming.progress.batch",
    "subject": {
      "type": "source_location",
      "file": "E:\\projetos\\spark-forge-aws\\fixtures\\streaming\\progress_unresolved\\input\\progress.jsonl",
      "line": 1,
      "col": 0,
      "symbol": "",
      "snippet": ""
    },
    "measures": {
      "batch_id": 20,
      "observed_index": 0,
      "input_rows_per_second": 100.0,
      "processed_rows_per_second": 100.0
    },
    "attrs": {
      "timestamp": "2026-10-01T11:00:00.000Z",
      "query_id": "q-2",
      "run_id": "r-2",
      "query_name": "events"
    },
    "provenance": {
      "artifact": "E:\\projetos\\spark-forge-aws\\fixtures\\streaming\\progress_unresolved\\input\\progress.jsonl",
      "artifact_sha256": "4b1732a2633c4df7411a29ea11ce0f86437bcee5de1191b837e5a1b5a5fdcf2a",
      "extractor": "streaming_progress@0.1.0"
    }
  },
  {
    "id": "f_5821b4",
    "schema_version": 1,
    "kind": "streaming.progress.unresolved",
    "subject": {
      "type": "source_location",
      "file": "E:\\projetos\\spark-forge-aws\\fixtures\\streaming\\progress_unresolved\\input\\progress.jsonl",
      "line": 1,
      "col": 0,
      "symbol": "",
      "snippet": ""
    },
    "measures": {},
    "attrs": {
      "reason": "insufficient_series",
      "required_observations": 2,
      "observed_observations": 1,
      "required_measurements": [
        "inputRowsPerSecond",
        "processedRowsPerSecond"
      ]
    },
    "provenance": {
      "artifact": "E:\\projetos\\spark-forge-aws\\fixtures\\streaming\\progress_unresolved\\input\\progress.jsonl",
      "artifact_sha256": "4b1732a2633c4df7411a29ea11ce0f86437bcee5de1191b837e5a1b5a5fdcf2a",
      "extractor": "streaming_progress@0.1.0"
    }
  },
  {
    "id": "f_165419",
    "schema_version": 1,
    "kind": "streaming.progress.unresolved",
    "subject": {
      "type": "source_location",
      "file": "E:\\projetos\\spark-forge-aws\\fixtures\\streaming\\progress_unresolved\\input\\progress.jsonl",
      "line": 2,
      "col": 0,
      "symbol": "",
      "snippet": ""
    },
    "measures": {},
    "attrs": {
      "reason": "invalid_json",
      "detail": "Expecting value"
    },
    "provenance": {
      "artifact": "E:\\projetos\\spark-forge-aws\\fixtures\\streaming\\progress_unresolved\\input\\progress.jsonl",
      "artifact_sha256": "4b1732a2633c4df7411a29ea11ce0f86437bcee5de1191b837e5a1b5a5fdcf2a",
      "extractor": "streaming_progress@0.1.0"
    }
  }
]
