[
  {
    "id": "f_f1bb2b",
    "schema_version": 1,
    "kind": "ctm.analyzed",
    "subject": {
      "type": "source_location",
      "file": "jobs.json",
      "line": 0,
      "col": 0,
      "symbol": "",
      "snippet": ""
    },
    "measures": {
      "folder_count": 1,
      "job_count": 1,
      "dependency_count": 3,
      "capability_probe_count": 0,
      "capability_unresolved_count": 0,
      "unresolved_count": 0
    },
    "attrs": {
      "version_declared": true
    },
    "provenance": {
      "artifact": "jobs.json",
      "artifact_sha256": "1e7220c5db55e50264f02e2f54c09d0531665417bcc965c171ce9eb5d6db9373",
      "extractor": "controlm_jobs@0.1.0"
    }
  },
  {
    "id": "f_3a40a9",
    "schema_version": 1,
    "kind": "ctm.dependency",
    "subject": {
      "type": "source_location",
      "file": "jobs.json",
      "line": 0,
      "col": 0,
      "symbol": "ConciliacaoDiaria/Concilia/EsperaAsCargas",
      "snippet": ""
    },
    "measures": {},
    "attrs": {
      "direction": "wait",
      "event": "CARGA-CLIENTES",
      "container": "WaitForEvents"
    },
    "provenance": {
      "artifact": "jobs.json",
      "artifact_sha256": "1e7220c5db55e50264f02e2f54c09d0531665417bcc965c171ce9eb5d6db9373",
      "extractor": "controlm_jobs@0.1.0"
    }
  },
  {
    "id": "f_3a40a9",
    "schema_version": 1,
    "kind": "ctm.dependency",
    "subject": {
      "type": "source_location",
      "file": "jobs.json",
      "line": 0,
      "col": 0,
      "symbol": "ConciliacaoDiaria/Concilia/EsperaAsCargas",
      "snippet": ""
    },
    "measures": {},
    "attrs": {
      "direction": "wait",
      "event": "CARGA-PEDIDOS",
      "container": "WaitForEvents"
    },
    "provenance": {
      "artifact": "jobs.json",
      "artifact_sha256": "1e7220c5db55e50264f02e2f54c09d0531665417bcc965c171ce9eb5d6db9373",
      "extractor": "controlm_jobs@0.1.0"
    }
  },
  {
    "id": "f_3a40a9",
    "schema_version": 1,
    "kind": "ctm.dependency",
    "subject": {
      "type": "source_location",
      "file": "jobs.json",
      "line": 0,
      "col": 0,
      "symbol": "ConciliacaoDiaria/Concilia/EsperaAsCargas",
      "snippet": ""
    },
    "measures": {},
    "attrs": {
      "direction": "wait",
      "event": "CARGA-ITENS",
      "container": "WaitForEvents"
    },
    "provenance": {
      "artifact": "jobs.json",
      "artifact_sha256": "1e7220c5db55e50264f02e2f54c09d0531665417bcc965c171ce9eb5d6db9373",
      "extractor": "controlm_jobs@0.1.0"
    }
  },
  {
    "id": "f_2e09c4",
    "schema_version": 1,
    "kind": "ctm.event_logic",
    "subject": {
      "type": "source_location",
      "file": "jobs.json",
      "line": 0,
      "col": 0,
      "symbol": "ConciliacaoDiaria/Concilia/EsperaAsCargas",
      "snippet": ""
    },
    "measures": {
      "max_paren_depth": 2,
      "open_paren_count": 2,
      "close_paren_count": 2,
      "operator_count": 2
    },
    "attrs": {
      "block": "WaitForEvents",
      "container": "WaitForEvents",
      "nested_parentheses": true,
      "balanced": true
    },
    "provenance": {
      "artifact": "jobs.json",
      "artifact_sha256": "1e7220c5db55e50264f02e2f54c09d0531665417bcc965c171ce9eb5d6db9373",
      "extractor": "controlm_jobs@0.1.0"
    }
  },
  {
    "id": "f_2b49b1",
    "schema_version": 1,
    "kind": "ctm.folder",
    "subject": {
      "type": "source_location",
      "file": "jobs.json",
      "line": 0,
      "col": 0,
      "symbol": "ConciliacaoDiaria",
      "snippet": ""
    },
    "measures": {},
    "attrs": {
      "folder_type": "Folder",
      "name": "ConciliacaoDiaria",
      "application": "Financeiro"
    },
    "provenance": {
      "artifact": "jobs.json",
      "artifact_sha256": "1e7220c5db55e50264f02e2f54c09d0531665417bcc965c171ce9eb5d6db9373",
      "extractor": "controlm_jobs@0.1.0"
    }
  },
  {
    "id": "f_6112b2",
    "schema_version": 1,
    "kind": "ctm.job",
    "subject": {
      "type": "source_location",
      "file": "jobs.json",
      "line": 0,
      "col": 0,
      "symbol": "ConciliacaoDiaria/Concilia",
      "snippet": ""
    },
    "measures": {},
    "attrs": {
      "job_type": "Job:Command",
      "name": "Concilia",
      "run_as": "ctmagent"
    },
    "provenance": {
      "artifact": "jobs.json",
      "artifact_sha256": "1e7220c5db55e50264f02e2f54c09d0531665417bcc965c171ce9eb5d6db9373",
      "extractor": "controlm_jobs@0.1.0"
    }
  },
  {
    "id": "f_1a6026",
    "schema_version": 1,
    "kind": "ctm.version_declared",
    "subject": {
      "type": "source_location",
      "file": "jobs.json",
      "line": 0,
      "col": 0,
      "symbol": "",
      "snippet": ""
    },
    "measures": {},
    "attrs": {
      "version": "9.0.22.010",
      "source": "operator_declaration",
      "read_from_artifact": false,
      "matrix_covers_from": "9.0.21.200",
      "matrix_covers_to": "9.0.22.100"
    },
    "provenance": {
      "artifact": "jobs.json",
      "artifact_sha256": "1e7220c5db55e50264f02e2f54c09d0531665417bcc965c171ce9eb5d6db9373",
      "extractor": "controlm_jobs@0.1.0"
    }
  }
]
