[
  {
    "id": "f_50444b",
    "schema_version": 1,
    "kind": "emrc.analyzed",
    "subject": {
      "type": "source_location",
      "file": "job.json",
      "line": 0,
      "col": 0,
      "symbol": "",
      "snippet": ""
    },
    "measures": {
      "virtual_cluster_count": 1,
      "job_run_count": 1,
      "configuration_count": 2,
      "conf_parameter_count": 2,
      "unresolved_count": 0
    },
    "attrs": {},
    "provenance": {
      "artifact": "job.json",
      "artifact_sha256": "e17d839ec525024d48b2e752999f8613da30b121c93d47097fba48ee93b033b5",
      "extractor": "emr_eks@0.1.1"
    }
  },
  {
    "id": "f_f8ceb2",
    "schema_version": 1,
    "kind": "emrc.configuration",
    "subject": {
      "type": "source_location",
      "file": "job.json",
      "line": 0,
      "col": 0,
      "symbol": "",
      "snippet": ""
    },
    "measures": {},
    "attrs": {
      "classification": "spark-defaults",
      "key": "spark.hadoop.fs.s3a.secret.key",
      "value": "<redigido>",
      "surface": "application_configuration",
      "redacted": true,
      "secret_pattern_match": true
    },
    "provenance": {
      "artifact": "job.json",
      "artifact_sha256": "e17d839ec525024d48b2e752999f8613da30b121c93d47097fba48ee93b033b5",
      "extractor": "emr_eks@0.1.1"
    }
  },
  {
    "id": "f_f8ceb2",
    "schema_version": 1,
    "kind": "emrc.configuration",
    "subject": {
      "type": "source_location",
      "file": "job.json",
      "line": 0,
      "col": 0,
      "symbol": "",
      "snippet": ""
    },
    "measures": {},
    "attrs": {
      "classification": "spark-defaults",
      "key": "spark.sql.shuffle.partitions",
      "value": "400",
      "surface": "application_configuration"
    },
    "provenance": {
      "artifact": "job.json",
      "artifact_sha256": "e17d839ec525024d48b2e752999f8613da30b121c93d47097fba48ee93b033b5",
      "extractor": "emr_eks@0.1.1"
    }
  },
  {
    "id": "f_3f7b6f",
    "schema_version": 1,
    "kind": "emrc.job_run",
    "subject": {
      "type": "source_location",
      "file": "job.json",
      "line": 0,
      "col": 0,
      "symbol": "",
      "snippet": ""
    },
    "measures": {
      "release_major": 7,
      "release_minor": 5
    },
    "attrs": {
      "job_run_id": "0000000segredo123",
      "name": "etl-com-credencial",
      "virtual_cluster_id": "0abcdefghijklmnop",
      "state": "COMPLETED",
      "release_label": "emr-7.5.0-latest",
      "execution_role_arn": "arn:aws:iam::111122223333:role/EMRContainersJobRole"
    },
    "provenance": {
      "artifact": "job.json",
      "artifact_sha256": "e17d839ec525024d48b2e752999f8613da30b121c93d47097fba48ee93b033b5",
      "extractor": "emr_eks@0.1.1"
    }
  },
  {
    "id": "f_2b8d9d",
    "schema_version": 1,
    "kind": "emrc.monitoring",
    "subject": {
      "type": "source_location",
      "file": "job.json",
      "line": 0,
      "col": 0,
      "symbol": "",
      "snippet": ""
    },
    "measures": {
      "log_destination_count": 1
    },
    "attrs": {
      "monitoring_declared": true,
      "s3_log_uri_present": true,
      "cloudwatch_enabled": false,
      "managed_logs_declared": false,
      "container_log_rotation_declared": false,
      "s3_log_uri": "s3://bucket/logs/",
      "persistent_app_ui_declared": true,
      "persistent_app_ui": "ENABLED"
    },
    "provenance": {
      "artifact": "job.json",
      "artifact_sha256": "e17d839ec525024d48b2e752999f8613da30b121c93d47097fba48ee93b033b5",
      "extractor": "emr_eks@0.1.1"
    }
  },
  {
    "id": "f_843e9a",
    "schema_version": 1,
    "kind": "emrc.spark_submit_parameters",
    "subject": {
      "type": "source_location",
      "file": "job.json",
      "line": 0,
      "col": 0,
      "symbol": "",
      "snippet": ""
    },
    "measures": {},
    "attrs": {
      "key": "spark.executor.instances",
      "value": "4",
      "surface": "spark_submit_parameters",
      "driver": "sparkSubmitJobDriver"
    },
    "provenance": {
      "artifact": "job.json",
      "artifact_sha256": "e17d839ec525024d48b2e752999f8613da30b121c93d47097fba48ee93b033b5",
      "extractor": "emr_eks@0.1.1"
    }
  },
  {
    "id": "f_843e9a",
    "schema_version": 1,
    "kind": "emrc.spark_submit_parameters",
    "subject": {
      "type": "source_location",
      "file": "job.json",
      "line": 0,
      "col": 0,
      "symbol": "",
      "snippet": ""
    },
    "measures": {},
    "attrs": {
      "key": "spark.sql.catalog.meta.uri",
      "value": "<redigido>",
      "surface": "spark_submit_parameters",
      "driver": "sparkSubmitJobDriver",
      "redacted": true,
      "secret_pattern_match": true
    },
    "provenance": {
      "artifact": "job.json",
      "artifact_sha256": "e17d839ec525024d48b2e752999f8613da30b121c93d47097fba48ee93b033b5",
      "extractor": "emr_eks@0.1.1"
    }
  },
  {
    "id": "f_de2764",
    "schema_version": 1,
    "kind": "emrc.virtual_cluster",
    "subject": {
      "type": "source_location",
      "file": "job.json",
      "line": 0,
      "col": 0,
      "symbol": "",
      "snippet": ""
    },
    "measures": {},
    "attrs": {
      "virtual_cluster_id": "0abcdefghijklmnop",
      "name": "analytics",
      "state": "RUNNING",
      "container_provider_type": "EKS",
      "eks_cluster_name": "producao-eks",
      "namespace": "spark"
    },
    "provenance": {
      "artifact": "job.json",
      "artifact_sha256": "e17d839ec525024d48b2e752999f8613da30b121c93d47097fba48ee93b033b5",
      "extractor": "emr_eks@0.1.1"
    }
  }
]
