[
  {
    "id": "f_5cc1cc",
    "schema_version": 1,
    "kind": "graph.module_analyzed",
    "subject": {
      "type": "source_location",
      "file": "job.py",
      "line": 0,
      "col": 0,
      "symbol": "",
      "snippet": ""
    },
    "measures": {
      "import_count": 0,
      "construction_count": 0,
      "algorithm_count": 0,
      "unresolved_count": 0
    },
    "attrs": {
      "parsed": true
    },
    "provenance": {
      "artifact": "job.py",
      "artifact_sha256": "a4f97720daa2e1c48216911ace89ebbd59a86cae26efaa8bc176ffa2d06379ae",
      "extractor": "graph@0.1.0"
    }
  }
]
